{
  "$schema": "http://json-schema.org/draft-07/schema#",
  "$id": "https://bindle/schemas/architecture/v1/judgment.schema.json",
  "title": "architecture v1 judgment record",
  "description": "One line of judgments.jsonl: the APPEND-ONLY authority for MEANING. DECISIONS ONLY -- an observed provider fact must never be written here merely because a projection ran. Records fold last-write-wins by FILE ORDER for a given arch_id; decided_at is audit only, so a clock skew cannot reorder meaning. The log is never compacted or rewritten in place.",
  "type": "object",
  "additionalProperties": false,
  "required": ["schema_version", "kind", "project_id", "decided_at", "record_id", "checksum"],
  "properties": {
    "schema_version": { "const": 1 },
    "kind": {
      "enum": [
        "identity_allocation",
        "naming",
        "grouping",
        "continuity",
        "rename",
        "reappearance",
        "split",
        "merge",
        "stale",
        "operator_amendment"
      ],
      "description": "Closed: an unknown kind is a validation error, never a silent pass."
    },
    "arch_id": {
      "type": "string",
      "pattern": "^arch-node:project:[0-9a-f]{32}:[0-9a-f]{32}$",
      "description": "Absent only for a decision that names no single node."
    },
    "project_id": { "type": "string", "pattern": "^project:[0-9a-f]{32}$" },
    "decided_at": {
      "type": "string",
      "format": "date-time",
      "description": "Human audit only. File order -- not this timestamp -- is authoritative."
    },
    "payload": {
      "type": "object",
      "description": "Kind-specific decision detail."
    },
    "record_id": {
      "type": "string",
      "pattern": "^arch-judgment:sha256:[0-9a-f]{64}$",
      "description": "Content-derived over the record MINUS record_id and checksum, so stamping is idempotent and a duplicated append is an exact repeat."
    },
    "checksum": {
      "type": "string",
      "pattern": "^sha256:[0-9a-f]{64}$",
      "description": "Over the record MINUS checksum, so it covers record_id. Per-record integrity is what lets a reader truncate-and-report a torn TRAILING line while hard-aborting on corruption anywhere else -- append_line_atomic gives durability, not crash atomicity."
    }
  },
  "allOf": [
    {
      "description": "Identity allocation is the one atomic append that PRECEDES any manifest or file write, so it must name the identity it allocates.",
      "if": { "properties": { "kind": { "const": "identity_allocation" } }, "required": ["kind"] },
      "then": { "required": ["arch_id"] }
    }
  ]
}
